{
  "$schema": "https://json-schema.org/draft/2020-12/schema",
  "$id": "cursebreaker://schemas/validation",
  "$defs": {
    "id": { "type": "string", "pattern": "^[a-z0-9]+(?:-[a-z0-9]+)*$" },
    "step": { "type": "object", "required": ["rule"], "properties": { "rule": { "type": "string", "minLength": 1 } } },
    "placement": {
      "type": "object", "additionalProperties": false,
      "required": ["introducedNode", "x", "y"],
      "properties": {
        "introducedNode": { "type": "integer", "minimum": 0 },
        "x": { "type": "number" },
        "y": { "type": "number" }
      }
    },
    "selection": {
      "type": "object", "additionalProperties": false,
      "required": ["region", "regions", "nodes", "wires"],
      "properties": {
        "region": { "type": "string", "minLength": 1 },
        "regions": { "type": "array", "items": { "type": "string", "minLength": 1 } },
        "nodes": { "type": "array", "items": { "type": "string", "minLength": 1 } },
        "wires": { "type": "array", "items": { "type": "string", "minLength": 1 } }
      }
    },
    "proofAction": {
      "type": "object", "additionalProperties": false,
      "required": ["label", "steps", "placements"],
      "properties": {
        "label": { "type": "string", "minLength": 1 },
        "steps": { "type": "array", "minItems": 1, "items": { "$ref": "#/$defs/step" } },
        "placements": { "type": "array", "items": { "$ref": "#/$defs/placement" } },
        "allocation": {
          "type": "object", "additionalProperties": false,
          "required": ["regions", "nodes", "wires"],
          "properties": {
            "regions": { "type": "array", "uniqueItems": true, "items": { "type": "string", "minLength": 1 } },
            "nodes": { "type": "array", "uniqueItems": true, "items": { "type": "string", "minLength": 1 } },
            "wires": { "type": "array", "uniqueItems": true, "items": { "type": "string", "minLength": 1 } }
          }
        }
      }
    },
    "artifactManifest": {
      "type": "object", "additionalProperties": false,
      "required": ["kind", "artifact", "region"],
      "properties": {
        "kind": { "const": "artifactManifest" },
        "artifact": { "$ref": "#/$defs/id" },
        "region": { "type": "string", "minLength": 1 }
      }
    },
    "artifactDissolve": {
      "type": "object", "additionalProperties": false,
      "required": ["kind", "artifact", "selection"],
      "properties": {
        "kind": { "const": "artifactDissolve" },
        "artifact": { "$ref": "#/$defs/id" },
        "selection": { "$ref": "#/$defs/selection" }
      }
    },
    "action": {
      "oneOf": [
        { "$ref": "#/$defs/proofAction" },
        { "$ref": "#/$defs/artifactManifest" },
        { "$ref": "#/$defs/artifactDissolve" }
      ]
    }
  },
  "type": "object", "additionalProperties": false,
  "required": ["puzzle", "solution", "availableArtifacts", "expectedRules", "recognizedStates"],
  "properties": {
    "puzzle": { "$ref": "#/$defs/id" },
    "solution": { "type": "array", "items": { "$ref": "#/$defs/action" } },
    "availableArtifacts": { "type": "array", "uniqueItems": true, "items": { "$ref": "#/$defs/id" } },
    "expectedRules": { "type": "array", "uniqueItems": true, "items": { "type": "string", "minLength": 1 } },
    "recognizedStates": {
      "type": "array",
      "items": {
        "type": "object", "additionalProperties": false, "required": ["intervention", "demonstration"],
        "properties": { "intervention": { "$ref": "#/$defs/id" }, "demonstration": { "type": "array", "minItems": 1, "items": { "$ref": "#/$defs/action" } } }
      }
    }
  }
}
