{
  "puzzle": "seyric-metamath-4exmid",
  "solution": [
    {
      "label": "doubleCutElim",
      "steps": [
        {
          "rule": "doubleCutElim",
          "region": "r4"
        }
      ],
      "placements": []
    },
    {
      "label": "doubleCutElim",
      "steps": [
        {
          "rule": "doubleCutElim",
          "region": "r10"
        }
      ],
      "placements": []
    },
    {
      "label": "iteration",
      "steps": [
        {
          "rule": "iteration",
          "sel": {
            "region": "r7",
            "regions": [
              "r8"
            ],
            "nodes": [],
            "wires": []
          },
          "target": "r9"
        }
      ],
      "placements": []
    },
    {
      "label": "deiteration",
      "steps": [
        {
          "rule": "deiteration",
          "sel": {
            "region": "r7",
            "regions": [
              "r9"
            ],
            "nodes": [],
            "wires": []
          },
          "justifier": {
            "region": "r3",
            "regions": [
              "r14"
            ],
            "nodes": [],
            "wires": []
          },
          "certificate": {
            "region": "r3",
            "regionMap": [
              [
                "binder_0",
                "r3"
              ],
              [
                "r9",
                "r14"
              ],
              [
                "r8_0",
                "r15"
              ]
            ],
            "nodeMap": [
              [
                "n2_0",
                "n7"
              ],
              [
                "n3",
                "n6"
              ]
            ],
            "wireMap": [],
            "attachments": [],
            "binderMap": [
              [
                "binder",
                "r2"
              ],
              [
                "binder_0",
                "r3"
              ]
            ],
            "termCertificates": []
          }
        }
      ],
      "placements": []
    },
    {
      "label": "doubleCutElim",
      "steps": [
        {
          "rule": "doubleCutElim",
          "region": "r7"
        }
      ],
      "placements": []
    },
    {
      "label": "doubleCutIntro",
      "steps": [
        {
          "rule": "doubleCutIntro",
          "sel": {
            "region": "r6",
            "regions": [],
            "nodes": [
              "n1"
            ],
            "wires": []
          }
        }
      ],
      "placements": []
    },
    {
      "label": "iteration",
      "steps": [
        {
          "rule": "iteration",
          "sel": {
            "region": "r6",
            "regions": [],
            "nodes": [
              "n0"
            ],
            "wires": []
          },
          "target": "dc"
        }
      ],
      "placements": []
    },
    {
      "label": "deiteration",
      "steps": [
        {
          "rule": "deiteration",
          "sel": {
            "region": "r6",
            "regions": [
              "dc"
            ],
            "nodes": [],
            "wires": []
          },
          "justifier": {
            "region": "r3",
            "regions": [
              "r12"
            ],
            "nodes": [],
            "wires": []
          },
          "certificate": {
            "region": "r3",
            "regionMap": [
              [
                "binder_0",
                "r3"
              ],
              [
                "dc",
                "r12"
              ],
              [
                "dc_0",
                "r13"
              ]
            ],
            "nodeMap": [
              [
                "n1",
                "n5"
              ],
              [
                "n0_0",
                "n4"
              ]
            ],
            "wireMap": [],
            "attachments": [],
            "binderMap": [
              [
                "binder",
                "r2"
              ],
              [
                "binder_0",
                "r3"
              ]
            ],
            "termCertificates": []
          }
        }
      ],
      "placements": []
    },
    {
      "label": "deiteration",
      "steps": [
        {
          "rule": "deiteration",
          "sel": {
            "region": "r6",
            "regions": [],
            "nodes": [
              "n0"
            ],
            "wires": []
          },
          "justifier": {
            "region": "r3",
            "regions": [],
            "nodes": [
              "n2"
            ],
            "wires": []
          },
          "certificate": {
            "region": "r3",
            "regionMap": [
              [
                "binder",
                "r3"
              ]
            ],
            "nodeMap": [
              [
                "n0",
                "n2"
              ]
            ],
            "wireMap": [],
            "attachments": [],
            "binderMap": [
              [
                "binder",
                "r2"
              ]
            ],
            "termCertificates": []
          }
        }
      ],
      "placements": []
    },
    {
      "label": "erasure",
      "steps": [
        {
          "rule": "erasure",
          "sel": {
            "region": "r3",
            "regions": [
              "r12",
              "r14"
            ],
            "nodes": [
              "n2"
            ],
            "wires": []
          }
        }
      ],
      "placements": []
    },
    {
      "label": "vacuousElim",
      "steps": [
        {
          "rule": "vacuousElim",
          "region": "r3"
        }
      ],
      "placements": []
    },
    {
      "label": "vacuousElim",
      "steps": [
        {
          "rule": "vacuousElim",
          "region": "r2"
        }
      ],
      "placements": []
    },
    {
      "label": "doubleCutElim",
      "steps": [
        {
          "rule": "doubleCutElim",
          "region": "r1"
        }
      ],
      "placements": []
    }
  ],
  "availableArtifacts": [],
  "expectedRules": [
    "doubleCutElim",
    "iteration",
    "deiteration",
    "doubleCutIntro",
    "erasure",
    "vacuousElim"
  ],
  "recognizedStates": []
}
