{
  "puzzle": "injection-branch-contrast",
  "solution": [
    {
      "label": "doubleCutElim",
      "steps": [
        {
          "rule": "doubleCutElim",
          "region": "r5"
        }
      ],
      "placements": []
    },
    {
      "label": "erasure",
      "steps": [
        {
          "rule": "erasure",
          "sel": {
            "region": "r4",
            "regions": [
              "r7",
              "r8"
            ],
            "nodes": [],
            "wires": []
          }
        }
      ],
      "placements": []
    },
    {
      "label": "deiteration",
      "steps": [
        {
          "rule": "deiteration",
          "sel": {
            "region": "r9",
            "regions": [],
            "nodes": [
              "n4"
            ],
            "wires": []
          },
          "justifier": {
            "region": "r4",
            "regions": [],
            "nodes": [
              "n1"
            ],
            "wires": []
          },
          "certificate": {
            "region": "r4",
            "regionMap": [
              [
                "binder",
                "r4"
              ]
            ],
            "nodeMap": [
              [
                "n4",
                "n1"
              ]
            ],
            "wireMap": [],
            "attachments": [],
            "binderMap": [
              [
                "binder",
                "r4"
              ]
            ],
            "termCertificates": []
          }
        }
      ],
      "placements": []
    },
    {
      "label": "erasure",
      "steps": [
        {
          "rule": "erasure",
          "sel": {
            "region": "r4",
            "regions": [],
            "nodes": [
              "n0",
              "n1"
            ],
            "wires": []
          }
        }
      ],
      "placements": []
    },
    {
      "label": "vacuousElim",
      "steps": [
        {
          "rule": "vacuousElim",
          "region": "r4"
        }
      ],
      "placements": []
    },
    {
      "label": "vacuousElim",
      "steps": [
        {
          "rule": "vacuousElim",
          "region": "r3"
        }
      ],
      "placements": []
    },
    {
      "label": "vacuousElim",
      "steps": [
        {
          "rule": "vacuousElim",
          "region": "r2"
        }
      ],
      "placements": []
    },
    {
      "label": "doubleCutElim",
      "steps": [
        {
          "rule": "doubleCutElim",
          "region": "r1"
        }
      ],
      "placements": []
    }
  ],
  "availableArtifacts": [],
  "expectedRules": [
    "doubleCutElim",
    "erasure",
    "deiteration",
    "vacuousElim"
  ],
  "recognizedStates": []
}
