{
  "puzzle": "disjunction-reassociation-recognition",
  "solution": [
    {
      "label": "doubleCutElim",
      "steps": [
        {
          "rule": "doubleCutElim",
          "region": "r9"
        }
      ],
      "placements": []
    },
    {
      "label": "deiteration",
      "steps": [
        {
          "rule": "deiteration",
          "sel": {
            "region": "r5",
            "regions": [
              "r6"
            ],
            "nodes": [],
            "wires": []
          },
          "justifier": {
            "region": "r4",
            "regions": [
              "r13"
            ],
            "nodes": [],
            "wires": []
          },
          "certificate": {
            "region": "r4",
            "regionMap": [
              [
                "binder",
                "r4"
              ],
              [
                "r6",
                "r13"
              ]
            ],
            "nodeMap": [
              [
                "n0",
                "n5"
              ]
            ],
            "wireMap": [],
            "attachments": [],
            "binderMap": [
              [
                "binder",
                "r2"
              ]
            ],
            "termCertificates": []
          }
        }
      ],
      "placements": []
    },
    {
      "label": "deiteration",
      "steps": [
        {
          "rule": "deiteration",
          "sel": {
            "region": "r5",
            "regions": [
              "r7"
            ],
            "nodes": [],
            "wires": []
          },
          "justifier": {
            "region": "r4",
            "regions": [
              "r12"
            ],
            "nodes": [],
            "wires": []
          },
          "certificate": {
            "region": "r4",
            "regionMap": [
              [
                "binder",
                "r4"
              ],
              [
                "r7",
                "r12"
              ]
            ],
            "nodeMap": [
              [
                "n1",
                "n4"
              ]
            ],
            "wireMap": [],
            "attachments": [],
            "binderMap": [
              [
                "binder",
                "r3"
              ]
            ],
            "termCertificates": []
          }
        }
      ],
      "placements": []
    },
    {
      "label": "deiteration",
      "steps": [
        {
          "rule": "deiteration",
          "sel": {
            "region": "r5",
            "regions": [
              "r8"
            ],
            "nodes": [],
            "wires": []
          },
          "justifier": {
            "region": "r4",
            "regions": [
              "r11"
            ],
            "nodes": [],
            "wires": []
          },
          "certificate": {
            "region": "r4",
            "regionMap": [
              [
                "binder",
                "r4"
              ],
              [
                "r8",
                "r11"
              ]
            ],
            "nodeMap": [
              [
                "n2",
                "n3"
              ]
            ],
            "wireMap": [],
            "attachments": [],
            "binderMap": [
              [
                "binder",
                "r4"
              ]
            ],
            "termCertificates": []
          }
        }
      ],
      "placements": []
    },
    {
      "label": "erasure",
      "steps": [
        {
          "rule": "erasure",
          "sel": {
            "region": "r4",
            "regions": [
              "r11",
              "r12",
              "r13"
            ],
            "nodes": [],
            "wires": []
          }
        }
      ],
      "placements": []
    },
    {
      "label": "vacuousElim",
      "steps": [
        {
          "rule": "vacuousElim",
          "region": "r4"
        }
      ],
      "placements": []
    },
    {
      "label": "vacuousElim",
      "steps": [
        {
          "rule": "vacuousElim",
          "region": "r3"
        }
      ],
      "placements": []
    },
    {
      "label": "vacuousElim",
      "steps": [
        {
          "rule": "vacuousElim",
          "region": "r2"
        }
      ],
      "placements": []
    },
    {
      "label": "doubleCutElim",
      "steps": [
        {
          "rule": "doubleCutElim",
          "region": "r1"
        }
      ],
      "placements": []
    }
  ],
  "availableArtifacts": [],
  "expectedRules": [
    "doubleCutElim",
    "deiteration",
    "erasure",
    "vacuousElim"
  ],
  "recognizedStates": []
}
