{
  "puzzle": "disjunction-over-conjunction-base",
  "solution": [
    {
      "label": "iteration",
      "steps": [
        {
          "rule": "iteration",
          "sel": {
            "region": "r4",
            "regions": [
              "r5"
            ],
            "nodes": [],
            "wires": []
          },
          "target": "r9"
        }
      ],
      "placements": []
    },
    {
      "label": "deiteration",
      "steps": [
        {
          "rule": "deiteration",
          "sel": {
            "region": "r5_0",
            "regions": [
              "r6_0"
            ],
            "nodes": [],
            "wires": []
          },
          "justifier": {
            "region": "r9",
            "regions": [
              "r10"
            ],
            "nodes": [],
            "wires": []
          },
          "certificate": {
            "region": "r9",
            "regionMap": [
              [
                "binder",
                "r9"
              ],
              [
                "r6_0",
                "r10"
              ]
            ],
            "nodeMap": [
              [
                "n0_0",
                "n3"
              ]
            ],
            "wireMap": [],
            "attachments": [],
            "binderMap": [
              [
                "binder",
                "r2"
              ]
            ],
            "termCertificates": []
          }
        }
      ],
      "placements": []
    },
    {
      "label": "doubleCutElim",
      "steps": [
        {
          "rule": "doubleCutElim",
          "region": "r5_0"
        }
      ],
      "placements": []
    },
    {
      "label": "deiteration",
      "steps": [
        {
          "rule": "deiteration",
          "sel": {
            "region": "r11",
            "regions": [],
            "nodes": [
              "n4"
            ],
            "wires": []
          },
          "justifier": {
            "region": "r9",
            "regions": [],
            "nodes": [
              "n1_0"
            ],
            "wires": []
          },
          "certificate": {
            "region": "r9",
            "regionMap": [
              [
                "binder",
                "r9"
              ]
            ],
            "nodeMap": [
              [
                "n4",
                "n1_0"
              ]
            ],
            "wireMap": [],
            "attachments": [],
            "binderMap": [
              [
                "binder",
                "r3"
              ]
            ],
            "termCertificates": []
          }
        }
      ],
      "placements": []
    },
    {
      "label": "erasure",
      "steps": [
        {
          "rule": "erasure",
          "sel": {
            "region": "r9",
            "regions": [
              "r10"
            ],
            "nodes": [
              "n1_0",
              "n2_0"
            ],
            "wires": []
          }
        }
      ],
      "placements": []
    },
    {
      "label": "doubleCutElim",
      "steps": [
        {
          "rule": "doubleCutElim",
          "region": "r9"
        }
      ],
      "placements": []
    },
    {
      "label": "iteration",
      "steps": [
        {
          "rule": "iteration",
          "sel": {
            "region": "r4",
            "regions": [
              "r5"
            ],
            "nodes": [],
            "wires": []
          },
          "target": "r12"
        }
      ],
      "placements": []
    },
    {
      "label": "deiteration",
      "steps": [
        {
          "rule": "deiteration",
          "sel": {
            "region": "r5_0",
            "regions": [
              "r6_0"
            ],
            "nodes": [],
            "wires": []
          },
          "justifier": {
            "region": "r12",
            "regions": [
              "r13"
            ],
            "nodes": [],
            "wires": []
          },
          "certificate": {
            "region": "r12",
            "regionMap": [
              [
                "binder",
                "r12"
              ],
              [
                "r6_0",
                "r13"
              ]
            ],
            "nodeMap": [
              [
                "n0_0",
                "n5"
              ]
            ],
            "wireMap": [],
            "attachments": [],
            "binderMap": [
              [
                "binder",
                "r2"
              ]
            ],
            "termCertificates": []
          }
        }
      ],
      "placements": []
    },
    {
      "label": "doubleCutElim",
      "steps": [
        {
          "rule": "doubleCutElim",
          "region": "r5_0"
        }
      ],
      "placements": []
    },
    {
      "label": "deiteration",
      "steps": [
        {
          "rule": "deiteration",
          "sel": {
            "region": "r14",
            "regions": [],
            "nodes": [
              "n6"
            ],
            "wires": []
          },
          "justifier": {
            "region": "r12",
            "regions": [],
            "nodes": [
              "n2_0"
            ],
            "wires": []
          },
          "certificate": {
            "region": "r12",
            "regionMap": [
              [
                "binder",
                "r12"
              ]
            ],
            "nodeMap": [
              [
                "n6",
                "n2_0"
              ]
            ],
            "wireMap": [],
            "attachments": [],
            "binderMap": [
              [
                "binder",
                "r4"
              ]
            ],
            "termCertificates": []
          }
        }
      ],
      "placements": []
    },
    {
      "label": "erasure",
      "steps": [
        {
          "rule": "erasure",
          "sel": {
            "region": "r12",
            "regions": [
              "r13"
            ],
            "nodes": [
              "n1_0",
              "n2_0"
            ],
            "wires": []
          }
        }
      ],
      "placements": []
    },
    {
      "label": "doubleCutElim",
      "steps": [
        {
          "rule": "doubleCutElim",
          "region": "r12"
        }
      ],
      "placements": []
    },
    {
      "label": "erasure",
      "steps": [
        {
          "rule": "erasure",
          "sel": {
            "region": "r4",
            "regions": [
              "r5"
            ],
            "nodes": [],
            "wires": []
          }
        }
      ],
      "placements": []
    },
    {
      "label": "vacuousElim",
      "steps": [
        {
          "rule": "vacuousElim",
          "region": "r4"
        }
      ],
      "placements": []
    },
    {
      "label": "vacuousElim",
      "steps": [
        {
          "rule": "vacuousElim",
          "region": "r3"
        }
      ],
      "placements": []
    },
    {
      "label": "vacuousElim",
      "steps": [
        {
          "rule": "vacuousElim",
          "region": "r2"
        }
      ],
      "placements": []
    },
    {
      "label": "doubleCutElim",
      "steps": [
        {
          "rule": "doubleCutElim",
          "region": "r1"
        }
      ],
      "placements": []
    }
  ],
  "availableArtifacts": [],
  "expectedRules": [
    "iteration",
    "deiteration",
    "doubleCutElim",
    "erasure",
    "vacuousElim"
  ],
  "recognizedStates": []
}
