{
  "puzzle": "seyric-metamath-meredith",
  "solution": [
    {
      "label": "doubleCutElim",
      "steps": [
        {
          "rule": "doubleCutElim",
          "region": "r19"
        }
      ],
      "placements": []
    },
    {
      "label": "doubleCutElim",
      "steps": [
        {
          "rule": "doubleCutElim",
          "region": "r23"
        }
      ],
      "placements": []
    },
    {
      "label": "deiteration",
      "steps": [
        {
          "rule": "deiteration",
          "sel": {
            "region": "r21",
            "regions": [
              "r22"
            ],
            "nodes": [],
            "wires": []
          },
          "justifier": {
            "region": "r6",
            "regions": [
              "r25"
            ],
            "nodes": [],
            "wires": []
          },
          "certificate": {
            "region": "r6",
            "regionMap": [
              [
                "binder",
                "r6"
              ],
              [
                "r22",
                "r25"
              ]
            ],
            "nodeMap": [
              [
                "n7",
                "n9"
              ]
            ],
            "wireMap": [],
            "attachments": [],
            "binderMap": [
              [
                "binder",
                "r2"
              ]
            ],
            "termCertificates": []
          }
        }
      ],
      "placements": []
    },
    {
      "label": "deiteration",
      "steps": [
        {
          "rule": "deiteration",
          "sel": {
            "region": "r7",
            "regions": [
              "r18"
            ],
            "nodes": [],
            "wires": []
          },
          "justifier": {
            "region": "r6",
            "regions": [
              "r21"
            ],
            "nodes": [],
            "wires": []
          },
          "certificate": {
            "region": "r6",
            "regionMap": [
              [
                "binder",
                "r6"
              ],
              [
                "r18",
                "r21"
              ]
            ],
            "nodeMap": [
              [
                "n5",
                "n6"
              ]
            ],
            "wireMap": [],
            "attachments": [],
            "binderMap": [
              [
                "binder",
                "r6"
              ]
            ],
            "termCertificates": []
          }
        }
      ],
      "placements": []
    },
    {
      "label": "doubleCutElim",
      "steps": [
        {
          "rule": "doubleCutElim",
          "region": "r7"
        }
      ],
      "placements": []
    },
    {
      "label": "deiteration",
      "steps": [
        {
          "rule": "deiteration",
          "sel": {
            "region": "r13",
            "regions": [
              "r14"
            ],
            "nodes": [],
            "wires": []
          },
          "justifier": {
            "region": "r6",
            "regions": [
              "r17"
            ],
            "nodes": [],
            "wires": []
          },
          "certificate": {
            "region": "r6",
            "regionMap": [
              [
                "binder",
                "r6"
              ],
              [
                "r14",
                "r17"
              ]
            ],
            "nodeMap": [
              [
                "n2",
                "n4"
              ]
            ],
            "wireMap": [],
            "attachments": [],
            "binderMap": [
              [
                "binder",
                "r4"
              ]
            ],
            "termCertificates": []
          }
        }
      ],
      "placements": []
    },
    {
      "label": "doubleCutElim",
      "steps": [
        {
          "rule": "doubleCutElim",
          "region": "r13"
        }
      ],
      "placements": []
    },
    {
      "label": "doubleCutElim",
      "steps": [
        {
          "rule": "doubleCutElim",
          "region": "r12"
        }
      ],
      "placements": []
    },
    {
      "label": "deiteration",
      "steps": [
        {
          "rule": "deiteration",
          "sel": {
            "region": "r9",
            "regions": [],
            "nodes": [
              "n3"
            ],
            "wires": []
          },
          "justifier": {
            "region": "r6",
            "regions": [],
            "nodes": [
              "n8"
            ],
            "wires": []
          },
          "certificate": {
            "region": "r6",
            "regionMap": [
              [
                "binder",
                "r6"
              ]
            ],
            "nodeMap": [
              [
                "n3",
                "n8"
              ]
            ],
            "wireMap": [],
            "attachments": [],
            "binderMap": [
              [
                "binder",
                "r5"
              ]
            ],
            "termCertificates": []
          }
        }
      ],
      "placements": []
    },
    {
      "label": "doubleCutElim",
      "steps": [
        {
          "rule": "doubleCutElim",
          "region": "r9"
        }
      ],
      "placements": []
    },
    {
      "label": "deiteration",
      "steps": [
        {
          "rule": "deiteration",
          "sel": {
            "region": "r25",
            "regions": [],
            "nodes": [
              "n9"
            ],
            "wires": []
          },
          "justifier": {
            "region": "r6",
            "regions": [],
            "nodes": [
              "n0"
            ],
            "wires": []
          },
          "certificate": {
            "region": "r6",
            "regionMap": [
              [
                "binder",
                "r6"
              ]
            ],
            "nodeMap": [
              [
                "n9",
                "n0"
              ]
            ],
            "wireMap": [],
            "attachments": [],
            "binderMap": [
              [
                "binder",
                "r2"
              ]
            ],
            "termCertificates": []
          }
        }
      ],
      "placements": []
    },
    {
      "label": "erasure",
      "steps": [
        {
          "rule": "erasure",
          "sel": {
            "region": "r6",
            "regions": [
              "r11",
              "r17",
              "r21"
            ],
            "nodes": [
              "n0",
              "n8"
            ],
            "wires": []
          }
        }
      ],
      "placements": []
    },
    {
      "label": "vacuousElim",
      "steps": [
        {
          "rule": "vacuousElim",
          "region": "r6"
        }
      ],
      "placements": []
    },
    {
      "label": "vacuousElim",
      "steps": [
        {
          "rule": "vacuousElim",
          "region": "r5"
        }
      ],
      "placements": []
    },
    {
      "label": "vacuousElim",
      "steps": [
        {
          "rule": "vacuousElim",
          "region": "r4"
        }
      ],
      "placements": []
    },
    {
      "label": "vacuousElim",
      "steps": [
        {
          "rule": "vacuousElim",
          "region": "r3"
        }
      ],
      "placements": []
    },
    {
      "label": "vacuousElim",
      "steps": [
        {
          "rule": "vacuousElim",
          "region": "r2"
        }
      ],
      "placements": []
    },
    {
      "label": "doubleCutElim",
      "steps": [
        {
          "rule": "doubleCutElim",
          "region": "r1"
        }
      ],
      "placements": []
    }
  ],
  "availableArtifacts": [],
  "expectedRules": [
    "doubleCutElim",
    "deiteration",
    "erasure",
    "vacuousElim"
  ],
  "recognizedStates": []
}
