{
  "puzzle": "two-veils",
  "solution": [
    {
      "label": "doubleCutElim",
      "steps": [
        {
          "rule": "doubleCutElim",
          "region": "r1"
        }
      ],
      "placements": []
    }
  ],
  "availableArtifacts": [],
  "expectedRules": [
    "doubleCutElim"
  ],
  "recognizedStates": []
}
