{
  "puzzle": "sey-ref-sel-i01",
  "solution": [
    {
      "kind": "artifactDissolve",
      "artifact": "single-mark-return",
      "selection": {
        "region": "r2",
        "regions": ["r1_0"],
        "nodes": [],
        "wires": []
      }
    },
    {
      "kind": "artifactDissolve",
      "artifact": "nested-owner-introduction",
      "selection": {
        "region": "r2",
        "regions": ["r1_1"],
        "nodes": [],
        "wires": []
      }
    },
    {
      "label": "doubleCutElim",
      "steps": [
        {
          "rule": "doubleCutElim",
          "region": "r1"
        }
      ],
      "placements": []
    }
  ],
  "availableArtifacts": [
    "single-mark-return",
    "nested-owner-introduction"
  ],
  "expectedRules": [
    "artifactDissolve",
    "doubleCutElim"
  ],
  "recognizedStates": []
}
