{
  "puzzle": "compound-conjunction-exchange",
  "solution": [
    {
      "label": "deiteration",
      "steps": [
        {
          "rule": "deiteration",
          "sel": {
            "region": "r8",
            "regions": [],
            "nodes": [
              "n5"
            ],
            "wires": []
          },
          "justifier": {
            "region": "r4",
            "regions": [],
            "nodes": [
              "n0"
            ],
            "wires": []
          },
          "certificate": {
            "region": "r4",
            "regionMap": [
              [
                "binder",
                "r4"
              ]
            ],
            "nodeMap": [
              [
                "n5",
                "n0"
              ]
            ],
            "wireMap": [],
            "attachments": [],
            "binderMap": [
              [
                "binder",
                "r2"
              ]
            ],
            "termCertificates": []
          }
        }
      ],
      "placements": []
    },
    {
      "label": "deiteration",
      "steps": [
        {
          "rule": "deiteration",
          "sel": {
            "region": "r8",
            "regions": [
              "r9"
            ],
            "nodes": [],
            "wires": []
          },
          "justifier": {
            "region": "r4",
            "regions": [
              "r5"
            ],
            "nodes": [],
            "wires": []
          },
          "certificate": {
            "region": "r4",
            "regionMap": [
              [
                "binder_0",
                "r4"
              ],
              [
                "r9",
                "r5"
              ],
              [
                "r10",
                "r6"
              ],
              [
                "r11",
                "r7"
              ]
            ],
            "nodeMap": [
              [
                "n3",
                "n1"
              ],
              [
                "n4",
                "n2"
              ]
            ],
            "wireMap": [],
            "attachments": [],
            "binderMap": [
              [
                "binder",
                "r3"
              ],
              [
                "binder_0",
                "r4"
              ]
            ],
            "termCertificates": []
          }
        }
      ],
      "placements": []
    },
    {
      "label": "erasure",
      "steps": [
        {
          "rule": "erasure",
          "sel": {
            "region": "r4",
            "regions": [
              "r5"
            ],
            "nodes": [
              "n0"
            ],
            "wires": []
          }
        }
      ],
      "placements": []
    },
    {
      "label": "vacuousElim",
      "steps": [
        {
          "rule": "vacuousElim",
          "region": "r4"
        }
      ],
      "placements": []
    },
    {
      "label": "vacuousElim",
      "steps": [
        {
          "rule": "vacuousElim",
          "region": "r3"
        }
      ],
      "placements": []
    },
    {
      "label": "vacuousElim",
      "steps": [
        {
          "rule": "vacuousElim",
          "region": "r2"
        }
      ],
      "placements": []
    },
    {
      "label": "doubleCutElim",
      "steps": [
        {
          "rule": "doubleCutElim",
          "region": "r1"
        }
      ],
      "placements": []
    }
  ],
  "availableArtifacts": [],
  "expectedRules": [
    "deiteration",
    "erasure",
    "vacuousElim",
    "doubleCutElim"
  ],
  "recognizedStates": []
}
