{
  "puzzle": "blank-witness",
  "solution": [
    {
      "label": "comprehensionInstantiate",
      "steps": [
        {
          "rule": "comprehensionInstantiate",
          "bubble": "r1",
          "comp": {
            "diagram": {
              "root": "r0",
              "regions": {
                "r0": {
                  "kind": "sheet"
                }
              },
              "nodes": {},
              "wires": {}
            },
            "boundary": []
          },
          "attachments": [],
          "binders": []
        }
      ],
      "placements": []
    }
  ],
  "availableArtifacts": [],
  "expectedRules": [
    "comprehensionInstantiate"
  ],
  "recognizedStates": []
}
