{
  "puzzle": "compound-double-cut-selection",
  "solution": [
    {
      "label": "doubleCutIntro",
      "steps": [
        {
          "rule": "doubleCutIntro",
          "sel": {
            "region": "r6",
            "regions": [],
            "nodes": [
              "n2",
              "n3"
            ],
            "wires": []
          }
        }
      ],
      "placements": []
    },
    {
      "label": "deiteration",
      "steps": [
        {
          "rule": "deiteration",
          "sel": {
            "region": "dc",
            "regions": [
              "dc_0"
            ],
            "nodes": [],
            "wires": []
          },
          "justifier": {
            "region": "r3",
            "regions": [
              "r4"
            ],
            "nodes": [],
            "wires": []
          },
          "certificate": {
            "region": "r3",
            "regionMap": [
              [
                "binder_0",
                "r3"
              ],
              [
                "dc_0",
                "r4"
              ]
            ],
            "nodeMap": [
              [
                "n2",
                "n0"
              ],
              [
                "n3",
                "n1"
              ]
            ],
            "wireMap": [],
            "attachments": [],
            "binderMap": [
              [
                "binder",
                "r2"
              ],
              [
                "binder_0",
                "r3"
              ]
            ],
            "termCertificates": []
          }
        }
      ],
      "placements": []
    },
    {
      "label": "erasure",
      "steps": [
        {
          "rule": "erasure",
          "sel": {
            "region": "r6",
            "regions": [],
            "nodes": [
              "n4"
            ],
            "wires": []
          }
        }
      ],
      "placements": []
    },
    {
      "label": "erasure",
      "steps": [
        {
          "rule": "erasure",
          "sel": {
            "region": "r3",
            "regions": [
              "r4"
            ],
            "nodes": [],
            "wires": []
          }
        }
      ],
      "placements": []
    },
    {
      "label": "vacuousElim",
      "steps": [
        {
          "rule": "vacuousElim",
          "region": "r3"
        }
      ],
      "placements": []
    },
    {
      "label": "vacuousElim",
      "steps": [
        {
          "rule": "vacuousElim",
          "region": "r2"
        }
      ],
      "placements": []
    },
    {
      "label": "doubleCutElim",
      "steps": [
        {
          "rule": "doubleCutElim",
          "region": "r1"
        }
      ],
      "placements": []
    },
    {
      "label": "doubleCutElim",
      "steps": [
        {
          "rule": "doubleCutElim",
          "region": "r6"
        }
      ],
      "placements": []
    }
  ],
  "availableArtifacts": [],
  "expectedRules": [
    "doubleCutIntro",
    "deiteration",
    "erasure",
    "vacuousElim",
    "doubleCutElim"
  ],
  "recognizedStates": []
}
