{
  "puzzle": "ch-or",
  "solution": [
    {
      "label": "doubleCutElim",
      "steps": [
        {
          "rule": "doubleCutElim",
          "region": "r13"
        }
      ],
      "placements": []
    },
    {
      "label": "deiteration",
      "steps": [
        {
          "rule": "deiteration",
          "sel": {
            "region": "r8",
            "regions": [
              "r9"
            ],
            "nodes": [],
            "wires": []
          },
          "justifier": {
            "region": "r7",
            "regions": [
              "r15"
            ],
            "nodes": [],
            "wires": []
          },
          "certificate": {
            "region": "r7",
            "regionMap": [
              [
                "binder_0",
                "r7"
              ],
              [
                "r9",
                "r15"
              ]
            ],
            "nodeMap": [
              [
                "n2",
                "n8"
              ],
              [
                "n3",
                "n9"
              ]
            ],
            "wireMap": [],
            "attachments": [],
            "binderMap": [
              [
                "binder",
                "r3"
              ],
              [
                "binder_0",
                "r7"
              ]
            ],
            "termCertificates": []
          }
        }
      ],
      "placements": []
    },
    {
      "label": "deiteration",
      "steps": [
        {
          "rule": "deiteration",
          "sel": {
            "region": "r10",
            "regions": [
              "r11"
            ],
            "nodes": [],
            "wires": []
          },
          "justifier": {
            "region": "r7",
            "regions": [
              "r8"
            ],
            "nodes": [],
            "wires": []
          },
          "certificate": {
            "region": "r7",
            "regionMap": [
              [
                "binder_0",
                "r7"
              ],
              [
                "r11",
                "r8"
              ]
            ],
            "nodeMap": [
              [
                "n4",
                "n0"
              ],
              [
                "n5",
                "n1"
              ]
            ],
            "wireMap": [],
            "attachments": [],
            "binderMap": [
              [
                "binder",
                "r2"
              ],
              [
                "binder_0",
                "r6"
              ]
            ],
            "termCertificates": []
          }
        }
      ],
      "placements": []
    },
    {
      "label": "deiteration",
      "steps": [
        {
          "rule": "deiteration",
          "sel": {
            "region": "r10",
            "regions": [
              "r12"
            ],
            "nodes": [],
            "wires": []
          },
          "justifier": {
            "region": "r7",
            "regions": [
              "r16"
            ],
            "nodes": [],
            "wires": []
          },
          "certificate": {
            "region": "r7",
            "regionMap": [
              [
                "binder_0",
                "r7"
              ],
              [
                "r12",
                "r16"
              ]
            ],
            "nodeMap": [
              [
                "n6",
                "n10"
              ],
              [
                "n7",
                "n11"
              ]
            ],
            "wireMap": [],
            "attachments": [],
            "binderMap": [
              [
                "binder",
                "r4"
              ],
              [
                "binder_0",
                "r5"
              ]
            ],
            "termCertificates": []
          }
        }
      ],
      "placements": []
    },
    {
      "label": "erasure",
      "steps": [
        {
          "rule": "erasure",
          "sel": {
            "region": "r7",
            "regions": [
              "r8",
              "r15",
              "r16"
            ],
            "nodes": [],
            "wires": []
          }
        }
      ],
      "placements": []
    },
    {
      "label": "vacuousElim",
      "steps": [
        {
          "rule": "vacuousElim",
          "region": "r7"
        }
      ],
      "placements": []
    },
    {
      "label": "vacuousElim",
      "steps": [
        {
          "rule": "vacuousElim",
          "region": "r6"
        }
      ],
      "placements": []
    },
    {
      "label": "vacuousElim",
      "steps": [
        {
          "rule": "vacuousElim",
          "region": "r5"
        }
      ],
      "placements": []
    },
    {
      "label": "vacuousElim",
      "steps": [
        {
          "rule": "vacuousElim",
          "region": "r4"
        }
      ],
      "placements": []
    },
    {
      "label": "vacuousElim",
      "steps": [
        {
          "rule": "vacuousElim",
          "region": "r3"
        }
      ],
      "placements": []
    },
    {
      "label": "vacuousElim",
      "steps": [
        {
          "rule": "vacuousElim",
          "region": "r2"
        }
      ],
      "placements": []
    },
    {
      "label": "doubleCutElim",
      "steps": [
        {
          "rule": "doubleCutElim",
          "region": "r1"
        }
      ],
      "placements": []
    }
  ],
  "availableArtifacts": [],
  "expectedRules": [
    "doubleCutElim",
    "deiteration",
    "erasure",
    "vacuousElim"
  ],
  "recognizedStates": []
}
